,created_at,favorite_count,full_text,id_str,lang,location,quote_count,reply_count,retweet_count,username,keyword
151,Thu Jun 06 02:33:15 +0000 2024,82,hah lu ngetik anjir wkwkw org jakarta jkt gada mikrolet angkot digeser diajak kerjasama pemerintah drivernya digaji,1798543645244805582,in,someone’s arms,2,12,2,rrkecil2,MRT.csv
152,Sun Jun 02 08:16:53 +0000 2024,399,dw pookieeeeee i will fight thanos prabski gibron oligarki jakarta supir angkot resekkk pki temenmu maksa kos bareng for youuuuuuuu,1797180574559597055,in,gf’s lover 🎀,15,18,33,sukagemi,MRT.csv
153,Fri Nov 10 10:52:02 +0000 2023,71,sopir angkot jakarta narik pakai selang oksigen bersyukur pondsxtzuyu tenangkankulitmu beritaindonesia beritadunia indonesiau,1722930105167876435,in,We don't own any content,6,12,1,caratstalk,MRT.csv
154,Thu May 30 15:07:04 +0000 2024,16,jakarta angkot busuk kek gitu bayangin daerah kek,1796196635011153950,in,💌 DM for PAID TWEETS 💌,1,2,5,arfdy12,MRT.csv
155,Thu Apr 11 12:41:59 +0000 2024,214,info kecelakaan angkot mobil sienta jalan matraman raya jakarta timur tepatnya pasar palmeriam kondisi mobil sienta mengalami rusak berat situasi lintas mengalami kepadatan p ferry elshintaweekend,1778403118394523937,in,,64,13,28,senjatanuklir,MRT.csv
156,Sun Mar 26 09:22:23 +0000 2023,3561,tangsel kota autopilot dibanggakan dibangun swasta spt bsd city bintaro jaya alam sutera transportasi kota usia tk angkot tua bayarnya pakai cash udahlah tangerang raya gabung jakarta pindah provinsi,1639920725137178626,in,"Jakarta Selatan, DKI Jakarta",187,164,498,ffikriawan,MRT.csv
157,Fri May 31 01:20:40 +0000 2024,8,jakarta angkot jaklingko hebat gubernur penghargaan it p,1796351052683612298,in,,0,0,0,FAGG0TARIAN,MRT.csv
158,Tue Apr 16 10:07:12 +0000 2024,3648,rt banyaknya angkot ngetem ruas jalan margonda raya kepadatan lalin mengarah jakarta elshintanews,1780176107918221701,in,"Bandung, Indonesia",352,430,557,txtdaribandung,MRT.csv
159,Fri Nov 15 08:21:36 +0000 2019,11763,cm adakah bantu isi kuisioner penelitian skripsiku kriterianya ragam transportasi jakarta tj angkot mrt lrt krl e money orang beruntung dm rep yaa barter jugaaa,1195255517834182656,in,,196,296,3420,tokopedia,MRT.csv
160,Thu May 30 10:09:47 +0000 2024,2934,ajg gua ombang ambing angkot jakarta,1796121822351544524,in,"Jakarta, ID | Breda, NL",260,91,780,adriansyahyasin,MRT.csv
162,Thu May 30 11:29:53 +0000 2024,147,orang kabupaten jakarta maunya diajak angkot,1796141981762240696,in,"Tangerang, Indonesia",0,8,9,inibacem,MRT.csv
163,Thu May 30 12:55:17 +0000 2024,2,sopir angkot jakarta utara dishub dki menepati janjinya mengintegrasikan angkutan reguler jaklingko,1796163472813670517,in,,0,0,0,ocdhii,MRT.csv
164,Thu May 30 03:42:57 +0000 2024,1533,jalur khusus bus salah tujuannya mengurangi lajur kendpri jakarta bangun busway penggusuran sengaja diperlebar iya min pembenahan transum udah tmb tmp amp angkot masuk brt lho,1796024473306460317,in,,16,5,71,ikandory28,MRT.csv
165,Fri May 31 01:31:48 +0000 2024,99,dips need respondents bantu isi kuisionerku yuk butuh responden deadlinenya besok kriterianya transportasi jakarta mrt krl lrt angkot tj linknya twt saldo rpk orang beruntung,1796353853883126041,in,pluto,0,23,2,robbyyxx,MRT.csv
166,Thu May 30 10:45:24 +0000 2024,39,angkot depok mahal jakarta depok deket k jkt k gue tau pake gojek busway td kaget,1796130784233025619,in,,1,0,4,ukiyotowabisabi,MRT.csv
169,Thu May 30 13:15:17 +0000 2024,2,sopir angkot tanjung priok jakarta utara gabung jaklingko kepastian,1796168504506486794,in,"Jakarta Capital Region, Indone",0,1,0,karimen_tubasa,MRT.csv
170,Tue May 28 10:04:27 +0000 2024,261,kartini ibuku rekan sepantarannya tetangga plesir jakarta beli eksrim ragusa charter angkot stasiun krl propublictransport,1795395703562444932,in,Jakarta Capital Region,7,6,56,drhaltekehalte,MRT.csv
171,Thu May 30 11:46:56 +0000 2024,28,kpd warga jakarta angkot jaklingko pake ktm unpad,1796146269775118404,in,"Jakarta Pusat, DKI Jakarta",0,5,2,getawayhcar,MRT.csv
172,Mon Mar 27 07:25:07 +0000 2023,10615,aloo adakah bantu isi kuisioner penelitian ta kriterianya ragam transportasi jakarta tj angkot mrt lrt krl e money orang beruntung dm yaa work,1640253600848039936,in,"Yogyakarta, Indonesia",126,256,3726,tirta_cipeng,MRT.csv
174,Fri Mar 26 01:23:45 +0000 2021,4438,lalinsonora banyaknya angkot ngetem ruas jalan margonda raya kepadatan lalin mengarah jakarta via,1375257132119982083,in,Indonesia,36,283,584,aniesbaswedan,MRT.csv
175,Thu May 30 12:35:08 +0000 2024,1074,anies bikin jaklingko angkot gratis jakarta sampe jalan beliau udh banget projek pendidikan sampe berjalan pikir situ hebat nepatin janji nya,1796158402877370576,in,Jakarta Capital Region,47,44,256,TriAditha,MRT.csv
176,Thu May 30 10:35:41 +0000 2024,280,angkot terbakar jakarta selatan kerugian capai rp juta news,1796128339482083642,in,Indonesia,15,21,94,txttransportasi,MRT.csv
177,Mon Jun 26 05:25:36 +0000 2023,1200,peringati angkutan nasional intip karoseri suzuki carry warnai angkot jakarta,1673200817309118466,in,"Jakarta Pusat, DKI Jakarta",2068,670,457,mrtjakarta,MRT.csv
178,Thu May 30 14:02:32 +0000 2024,2028,need respondents bantu isi kuisionerku yuk butuh responden deadlinenya besok kriterianya transportasi jakarta mrt krl lrt angkot tj saldo rpk orang beruntung linknya twt,1796180396226248804,in,,37,10,144,nanaditaa,MRT.csv
179,Sun Mar 24 00:30:04 +0000 2019,5321,an btl jakarta kerja kenek supir angkot tembak kena jaring pemprov dki pas disisir bang ali kaget bang ali lulus sma jaman lulus sma pencapaian oke dimasukin dishub,1109613312839319552,in,,886,909,7703,Sutopo_PN,MRT.csv
180,Sun Jun 02 14:18:02 +0000 2024,363,angkot memotret warung madura jakarta kesabaran kehematan bertahan membiayai anak anaknya mondok sekolah menerima masukan konsumen melayani teleponan,1797271459620106373,in,Jakarta Capital Region,22,20,108,drhaltekehalte,MRT.csv
183,Sun Jul 14 08:13:35 +0000 2019,4264,angkot angkot jakarta bekasi kota normal peminatnya,1150317404855005184,in,,59,402,695,msaid_didu,MRT.csv
184,Mon Mar 25 11:52:29 +0000 2019,2035,gua tauuu tiket flight domestik harganya ngotak kocak ngetweet ngecompare tiket padang jakarta jt padang rban kayak lu naek angkot jakarta bogor jakarta jogja beda gasih ongkosnya appleapple,1110147439942500352,in,INDONESIA,90,194,951,PriyoBudiS,MRT.csv
185,Fri Apr 12 16:01:58 +0000 2019,11291,pemerintah pemerintah berulang ulang gua bilang jakarta percontohan angkot terintegrasi tuh susah sistem transmum,1116733204365336576,in,,294,1413,3491,Dahnilanzar,MRT.csv
186,Sat Jul 13 03:40:59 +0000 2019,5222,aloo adakah bantu isi kuisioner penelitian ta butuh responden kriterianya ragam transportasi jakarta tj angkot mrt lrt krl e money orang beruntung cont,1149886415443914752,in,"Jakarta, Indonesia",209,337,1489,MataNajwa,MRT.csv
187,Fri Mar 15 06:35:41 +0000 2024,24524,setuju supir taksi jepang supir angkot jakarta wkwkwk ril cuy no fek gue mendingan supir angkot jkt nurunin penumpang mepet pinggir jalan supir taksi mah ditengah minggir wkwkwk,1768526465925312640,in,Jakarta,332,882,947,L_MarshaJKT48,MRT.csv
188,Tue May 28 23:00:55 +0000 2024,12,emang anjing angkot jakarta kecopetan deket alfamart pasar senen dihadang orang sopir nungguin pake angkot ketiplek angkot video kerasa dicopet ilang hape ngejer barang bawaan bener orang ngelietin doang,1795591110011900151,in,Kuala Lumpur City,0,4,0,httpshijkl,MRT.csv
189,Fri May 31 13:13:07 +0000 2024,374,first jobber kota sih kerja jakarta tuh emang bener kos mrt lrt busway angkot ojol sampe ribu udah nyampe kantor gpp duit pas pasan cape fisik amp cape pikiran plus abis perjalanan,1796530348995833917,in,ジャカルタ,9,23,68,ErikkuRii,MRT.csv
190,Mon Jun 03 23:36:48 +0000 2024,5,wkwkwk inget jakarta liat toko amp angkot sigernya berasa pulkam,1797774464392089874,in,,0,0,1,MrtKrklk,MRT.csv
191,Thu May 30 11:49:17 +0000 2024,82,angkot gw tinggal peremajaan armada supir suka nyetir trayek gemuk sisa orang tua muda muda udh ojol jakarta supir angkot udh gabung jaklingko pindah ojol wkwk,1796146861306175955,in,"Houston, TX",9,5,24,Adrianussatrio,MRT.csv
192,Mon Mar 25 14:01:45 +0000 2019,7375,aloo bantu isi kuisioner penelitian ta kriterianya ragam transportasi jakarta tj angkot mrt lrt krl e money orang beruntung dm yaa barteran yupi,1110179967713763329,in,,108,407,1901,Dahnilanzar,MRT.csv
193,Fri May 31 11:41:12 +0000 2024,12,work bantu isi kuisioner skripsiku kriterianya ragam transportasi jakarta tj angkot mrt lrt krl e money orang beruntung dm ayoo bantu lulus kak,1796507217602199786,in,"Sepang, Selangor",1,0,6,HaziqhMuhammad,MRT.csv
194,Tue Dec 13 11:17:42 +0000 2022,5853,angkot jaklingko rp diminati warga jakarta,1602623792198582273,in,"Jakarta, ID | Breda, NL",1061,781,946,adriansyahyasin,MRT.csv
195,Thu May 30 10:59:55 +0000 2024,61,nya takbiran rame rame nyewa angkot muter keliling jakarta atap angkotnya anjir seru banget,1796134438998523938,in,,12,1,39,NarasiNewsroom,MRT.csv
196,Thu May 30 14:05:03 +0000 2024,3,tk diantar sd pas lhokseumawe jalan kaki pas medan full pas jakarta jemputan angkot smp jemputan sma angkot kuliah bawa mobil angkot,1796181029469688093,in,windermere peaks,0,1,0,slowthedive,MRT.csv
197,Sat Mar 23 01:54:11 +0000 2019,5089,lalinsonora lintas ruas jl raya sawangan arah depok terpantau macet imbas kendaraan angkot mengalami gangguan mesin didekat pertigaan rs bhakti yudha via bp aang,1109272093898596352,in,,282,964,2378,mkusumawijaya,MRT.csv
198,Thu May 30 11:45:24 +0000 2024,26,udah gue duga nggak truk zaman angkot jakarta skrg perhatikan angkot biru a banget ketemu supir underage ugalan,1796145885157695596,in,,3,1,7,inilahdotcom,MRT.csv
199,Thu May 30 14:53:37 +0000 2024,20,mimin pingin tau nih kenangan angkot wilujeng enjing cemunguutt cim infocimahi cimahi kotacimahi bandung jawabarat jakarta pagi semangat angkot,1796193250644029846,in,,1,3,8,detikcom,MRT.csv
200,Wed May 29 16:40:21 +0000 2024,17,suzuki carry disulap warnai angkot jakarta gooto,1795857725135388973,in,,0,0,0,Naop_68,MRT.csv
201,Sat Jun 01 05:13:15 +0000 2024,2,sopir angkot jakarta utara mengaku menombok uang setoran sewa angkot akibat sepinya penumpang,1796771972376150150,in,Jakarta - Indonesia,0,0,0,vidiiphotograph,MRT.csv
202,Thu Jun 06 07:32:44 +0000 2024,1,jakarta sistem kuota total angkot konvesional dpt kuota mikrotrans,1798619012836053067,in,Jakarta,0,0,0,KATADATAcoid,MRT.csv
203,Tue Jun 04 04:09:29 +0000 2024,94,duuhh sayang angkutan kota angkot jakarta blm diseragamin jaklingko enak gapake ngetem trs supirnya nyetirnya jg ugalan ngerokok sepengalaman gue sih,1797843089949946264,in,Coruscant,0,3,12,afnanboma10,MRT.csv
204,Fri May 31 07:00:14 +0000 2024,3,lalinsonora lintas macet ace hardware intercon arah pom meruya kembangan akibat angkot biru ngetem,1796436508410585483,in,,0,0,0,yzreell,MRT.csv
205,Thu Mar 19 15:28:33 +0000 2020,18948,jakarta angkot to apakanat jaklingo,1240661446909767681,in,,3228,1232,9046,CNNIndonesia,MRT.csv
206,Thu Jun 06 06:40:15 +0000 2024,2,pesawat pas jakarta pesawat pas bokap meninggal tj pas abis ngegep mantan selingkuh jaraknya halte karet benhil angkot sekolah dapet ranking,1798605807820714123,in,,1,3,0,abrianabitha,MRT.csv
207,Sun Mar 24 13:00:09 +0000 2019,11665,cm need respondents bantu isi kuisionerku yuk butuh responden deadlinenya besok kriterianya transportasi jakarta mrt krl lrt angkot tj saldo rpk orang beruntung linknya twt,1109802080615591941,in,Indonesia,761,890,5033,aniesbaswedan,MRT.csv
208,Fri May 31 18:29:14 +0000 2024,2,layanan transjakarta m rute pulo gadung wali kota jakarta utara beroperasi dinas perhubungan dki jakarta syafrin liputo mengakui rute penolakan sopir angkot transjakarta angkot medcomid,1796609901978120476,in,,0,0,0,syandutt,MRT.csv
209,Fri Jul 05 07:14:23 +0000 2019,2981,bicara transportasi serasa pindah planet jakarta udah krl mrt lrt tj jaklingko angkot bandung jam malam udah pd pulang ojol fluktuatif kdg murah kdg mahal beli mio mirza bekas harga jtan servis cvt dlu biar kuat nanjak,1147041016437850112,in,,93,230,702,FaGtng,MRT.csv
210,Mon Jun 03 22:34:40 +0000 2024,323,bukti nyata warga jakarta menikmatin angkot gratis,1797758829318586678,in,Jakarta Capital Region,12,10,27,RidhaIntifadha,MRT.csv
211,Fri May 31 14:45:46 +0000 2024,3,angkot mikrotrans jaklingko suka salah capres dulunya menggagas perbaikan angkot jakarta aneh it doesn t make sense at all,1796553665291137082,in,Jakarta Capital Region,0,1,0,mytrash06,MRT.csv
212,Wed Jun 05 00:35:15 +0000 2024,2,angkot terminal tanjung priok jakarta utara mengalami peremajaan pembaruan bergabung jaklingko,1798151564257100204,in,in jjfuaiz we trust! ୭ ˚. ᵎᵎ,1,1,0,Porschje,MRT.csv
213,Fri May 31 14:08:22 +0000 2024,3,dinas perhubungan dishub dki jakarta komunikasi sopir angkot terkait layanan bus transjakarta m rute pulo gadung wali kota jakarta utara,1796544252786471325,in,tokyo,0,0,0,eripico_,MRT.csv
214,Tue Mar 26 13:58:29 +0000 2024,13695,keterbatasan biaya amsori memilih mengontrak rumah tidur angkot sewaannya,1772624164605620613,in,,566,405,1701,OposisiCerdas,MRT.csv
215,Thu May 30 11:00:12 +0000 2024,3,aggaran tersedianya penyebab angkot reguler jakarta utara jakut bergabung jaklingko,1796134510788071715,in,🍉,0,1,3,akidoverseas,MRT.csv
217,Fri Jan 21 05:55:22 +0000 2022,2536,pengemudi angkot gelar aksi mogok beroperasi jalan tipar cakung jakarta utara bentuk aksi penolakan pengoperasian bus transjakarta,1484404230165532675,in,,26,365,395,GeiszChalifah,MRT.csv
218,Thu Apr 27 11:50:59 +0000 2023,6306,karoseri suzuki carry warnai angkot jakarta,1651554532630089728,in,"Jakarta, ID | Breda, NL",373,214,1414,adriansyahyasin,MRT.csv
0,Mon Apr 29 11:50:32 +0000 2024,5,pekan berkesempatan menjajal alibo angkot listrik bogor kesan pertamanya mikrotrans ac jakarta ujicoba unit nunggunya lumayan pembayaran brizzi katanyasih bertahap kue untung qris sih,1784913153320693773,in,Naverland my love ,0,1,0,sunnypieyum,Semarang-angkot.csv
1,Sun Feb 11 05:22:32 +0000 2024,186,tinggal jakarta gapunya kendaraan ngerasa kesusahan karna angkot gratis tj deket bayar ngerantau kota bandung ngerasain banget perbedaan transportasi,1756549256389984732,in,info:,30,110,32,SmgMenfess2,Semarang-angkot.csv
2,Sun May 28 04:46:03 +0000 2023,0,penasaran jakarta tuh abis duit bikin angkot jaklingko gratis bikin pengemudi angkot pekerja formal digaji kerasa bener servicenya bagus angkot pake acara drama ngetem maju mundur gang,1662681618031742976,in,,0,1,0,zjanghaou,Semarang-angkot.csv
3,Tue Feb 28 15:08:24 +0000 2023,34,sopir lansia jakarta tidur angkot sewa kontrakan kehidupan sopir angkot lansia jakarta bernama amsori dijalani penuh kesulitan pendapatan mencukupi memaksa amsori tidur angkotnya,1630585718555967488,in,"Kota Surabaya, Jawa Timur",2,3,6,sbyfess,Semarang-angkot.csv
4,Fri Mar 01 13:18:35 +0000 2024,1,celaka akibat hindari angkot berhenti mata pengendara motor tertancap batang besi spion terjatuh motor akibat menghindari angkot berhenti dipinggir jalan jl raya pramuka kel utan kayu kec matraman jakarta timur jumat,1763554429389975980,in,,0,0,0,colinadenia,Semarang-angkot.csv
5,Sat May 04 02:53:30 +0000 2024,3,bayangin angkot jam malem stasiun depok kerja seharian jakarta tau besoknya berangkat menembus kemacetan jam pagi ikan sarden krl biar nyampe kantor gajinya kali,1786589945681039492,in,,0,0,0,idlelicates,Semarang-angkot.csv
6,Fri Oct 27 10:44:28 +0000 2023,0,pemerintah penengah penyelesai demo menjurus anarkis sopir angkot merugikan masyarakat netijen solusi nya,1717854773834367462,in,Indonesia,0,1,0,IDKennedyAdv,Semarang-angkot.csv
7,Sun Dec 10 15:05:22 +0000 2023,0,hai fairies tim apem update nih total paket takjil paket mini takjil dibagikan orang orang membutuhkan satpam driver ojol angkot tim apem jakarta international velodrome rawamangun,1733865493977837972,in,,0,0,0,Nassrayy,Semarang-angkot.csv
8,Sat Mar 02 01:47:41 +0000 2024,0,urgent angkot malang treatment jaklingko jakarta braw,1763742946334228964,in,,0,0,0,skangawrrr,Semarang-angkot.csv
9,Mon Oct 23 04:27:21 +0000 2023,18,angkot jakarta vs angkot solo menyala soloku,1716310315649097889,in,𝙅𝙖𝙠𝙖𝙧𝙩𝙖,0,0,3,Alie_Fahnoor,Semarang-angkot.csv
10,Sat Mar 18 14:17:30 +0000 2023,120,kejadian jalan margasatwa raya pasar minggu jakarta selatan angkot mencoba masuk jalur transjakarta diduga muncul bus transjakarta lajur kanan dihindari angkot terjepit pembatas jalan bus transjakarta,1637095889364992000,in,"Semarang, Indonesia",6,33,24,syahirularif,Semarang-angkot.csv
11,Fri Jan 06 06:05:01 +0000 2023,55,reformasi angkot membutuhkan komunikasi jakarta membutuhkan puluhan diskusi pelaku angkot terintegrasi sistem pelaku angkot jaminan operasional layak bersedia bergabung sistem,1611242412235714561,in,"Ganesha, Jatinangor, Cirebon",5,4,2,itbfess,Semarang-angkot.csv
12,Tue Feb 28 15:05:07 +0000 2023,2,gue pengguna transportasi publik non jakarta angkot bis miniarta elp terlintas bagus berpikir kendaraan bagus jalanan jelek grgr bupatinya korupsi mlu mahal bjir,1630584893116674054,in,Indonesia,1,2,0,tanyakanrl,Semarang-angkot.csv
13,Wed Jun 14 12:26:10 +0000 2023,1,transjakarta rute pulo gadung walkot jakut via tipar cakung supir angkot lakukan protes puluhan sopir angkot jalan tipar cakung jakarta utara menggelar aksi protes jalan tipar cakung puskesmas sukapura jumat pagi memprotes,1668958005755523073,in,,0,0,1,Penyair_Berdiri,Semarang-angkot.csv
14,Sat Apr 06 01:35:37 +0000 2024,0,menerima informasi sopir angkot u menggelar aksi unjuk menolak transjakarta rute m pulo gadung kantor wali kota jakarta utara via tipar cakung beroperasi senin dihentikan,1776423483087671463,in,,1,2,0,Nasirullah5itam,Semarang-angkot.csv
15,Wed Jul 26 02:47:22 +0000 2023,0,kecelakaan lintas melibatkan mobil angkot a jurusan kampung melayu gandaria pengemudi ojek online angkot menabrak melindas pengemudi ojol penumpangnya berhenti lampu merah flyover pasar rebo jalan raya bogor ciracas jakarta timur,1684032633158930433,in,,0,8,0,nauismyname,Semarang-angkot.csv
16,Tue Oct 31 14:26:49 +0000 2023,0,angkot eksisting bereskan pemerintah lokal bodetabek makan transportasi modern nyaman masyarakat kenyataan,1719360278461366489,in,she/her!02L,0,2,0,JidatnyaJoshua,Semarang-angkot.csv
17,Tue May 02 04:27:27 +0000 2023,9,jakarta ngampus mirkolet angkot ps minggu lb bulus tarif kisaran k k mikroletnya udah jurusan tj u angkotnya udah jak lingkonya tarif k gratis bandung angkot deui bandung,1653254851562975234,in,"Semarang, Indonesia",0,5,2,syahirularif,Semarang-angkot.csv
18,Mon Nov 13 09:07:12 +0000 2023,0,satunya bikin gw bangga warga jakarta mikrotrans alias angkot gratis,1723990888979005802,in,,0,0,0,Olikotor_,Semarang-angkot.csv
19,Tue May 07 16:08:37 +0000 2024,0,adakah bantu isi kuisioner penelitian skripsiku kriterianya ragam transportasi jakarta tj angkot mrt lrt krl e money orang beruntung dm rep yaa dips,1787877207169437768,in,,0,1,0,jakeipa,Semarang-angkot.csv
20,Tue Apr 02 13:50:59 +0000 2024,1,tije berusaha terbaik melayani masyarakat menghadirkan rute bermanfaat faktor tangsel bptj bs dishub tangsel angkot parung kaya tau,1775158991641002465,in,"South Semarang, Indonesia",0,0,0,polsekgajahmgkr,Semarang-angkot.csv
21,Sat Dec 16 07:37:34 +0000 2023,0,cm need respondents bantu isi kuisioner penelitian skripsiku butuh responden huhu kriterianya ragam transportasi jakarta tj angkot mrt krl lrt linknya drop komentar dm jg total saldo k cont,1735927130205331467,in,"Solo, Central Java, Indonesia",0,0,0,soloposdotcom,Semarang-angkot.csv
22,Fri Mar 22 13:04:43 +0000 2024,12,lulus orang jakarta angkot,1771161084445212743,in,info:,0,6,0,SmgMenfess2,Semarang-angkot.csv
23,Fri Feb 09 08:30:27 +0000 2024,103,perorangan pakai pertamax shell super subsidi bbm sih ngaruh tu kurir ekspedisi truck ayam truck sayur gojek angkot elf jakarta serang pakenya pertalite solar mampus lu rasain harga harga naek,1755871772304650448,in,Jepang,3,6,4,_hanawbi,Semarang-angkot.csv
24,Sat Mar 23 12:22:05 +0000 2024,4,angkot jakarta tuhhh luas gasii angkot bogor,1771512740126802116,in,info:,0,5,0,SmgMenfess2,Semarang-angkot.csv
25,Thu Mar 21 06:13:30 +0000 2024,0,halo jfriends mencoba angkot ac gratis jakarta salah rute dilayani angkot ac mikrotrans jak terminal rawamangun manggarai via pisangan pondok jati mikrotrans dimiliki pt lestari surya gema persada lsg,1770695210428776907,in,,0,1,0,antibacterii,Semarang-angkot.csv
26,Sun Oct 29 10:37:58 +0000 2023,0,rekapan nyoblos ni kertas alumni ugm kertas petahana kertas ketiga ex calon wagub kertas keempat supir angkot done from tps jagakarsa jakarta selatan jangangolput,1718577910305730876,in,"Jawa Tengah, Indonesia",0,0,0,johnjenggot,Semarang-angkot.csv
27,Tue Apr 02 13:48:04 +0000 2024,1,sopir angkot kwk jurusan grogol cengkareng viral memakai selang oksigen menderita penyakit berbahaya sopir angkot bernama sa at berasal medan merantau jakarta ist,1775158258384408986,in,"South Semarang, Indonesia",0,0,0,PolsekTembalang,Semarang-angkot.csv
28,Thu Feb 15 13:55:40 +0000 2024,6,tinggal jakarta tj angkot kwk merah jaklingko kena macet mengeluh wajar wajar orang ngeluh macet kendaaran pribadi salah penyumbang kemacetan kendaraan pake,1758127944155996392,in,info:,0,1,0,SmgMenfess2,Semarang-angkot.csv
29,Sat Jun 03 16:19:11 +0000 2023,82,rute transjakarta pulo gadung walikota jakarta utara via tipar cakung m dihentikan protes sopir angkot sehubungan penolakan sopir angkutan reguler u pembukaan rute m rute m dihentikan kepala,1665030376568369152,in,"Houston, TX",5,6,15,Adrianussatrio,Semarang-angkot.csv
30,Mon Oct 02 11:10:08 +0000 2023,0,kek nya nunggu cewe makeup bandung jakarta via angkot,1708801536661635542,in,⬇️BACA RULES JANGAN NGELANGGAR,0,1,0,undipmenfess,Semarang-angkot.csv
31,Mon Dec 18 05:20:50 +0000 2023,1,bantu isi kuisioner penelitianku butuh responden kriterianya ragam transportasi jakarta tj angkot mrt lrt krl saldo e wallet total k orang beruntung drop cont,1736617495942029696,in,,0,0,0,zakipohansaja,Semarang-angkot.csv
32,Tue Jan 09 01:43:21 +0000 2024,3,harga angkot jakarta berapaan sih,1744535296707059847,in,Rules:,0,3,0,SmgMenfess,Semarang-angkot.csv
33,Thu Jul 06 03:28:32 +0000 2023,0,transum jakarta tuh penumpang mrt menit disuruh transit angkot menit,1676795234980876289,in,,0,1,1,DiyanJoko,Semarang-angkot.csv
34,Fri Dec 08 03:21:51 +0000 2023,0,minggu gw intens bolak jakarta bekasi motor gw jaklinko pas udh sampe jalur bekasi udah jaklinko tuh pake angkot merah minggu naek angkot merah tarifnya beda cuk wkwk,1732963674657300788,in,,0,0,0,anotherspesies,Semarang-angkot.csv
35,Sun Mar 19 09:19:43 +0000 2023,6,faktanya kota kapasitas fiskalnya memadai bangun mrt jakarta itupun dibantu pusat aneh rakyat jelata kemakan janji bangun transum masal kota setara jakarta setara angkot jaklingko aj sih,1637383338188234752,in,Semarang,0,1,0,Em_7015,Semarang-angkot.csv
36,Fri Sep 15 08:11:25 +0000 2023,0,guys orang bandung jakarta rencananya jakarta fair kereta gimana kayak turun stasiun angkot ojolnya gitu takut nyasar nanya nanya disana takut berniat,1702595965633618073,in,not spoiler free here bb ☺️,0,1,0,biblluc,Semarang-angkot.csv
37,Sun Nov 26 11:17:24 +0000 2023,3,hah lu ngetik anjir wkwkw org jakarta jkt gada mikrolet angkot digeser diajak kerjasama pemerintah drivernya digaji,1728734697323393408,in,info:,0,2,0,SmgMenfess2,Semarang-angkot.csv
38,Mon Feb 20 08:46:13 +0000 2023,0,dw pookieeeeee i will fight thanos prabski gibron oligarki jakarta supir angkot resekkk pki temenmu maksa kos bareng for youuuuuuuu,1627590433630228482,in,Semarang - Jawa Tengah,0,0,0,kuasakatacom,Semarang-angkot.csv
39,Wed Apr 26 06:25:01 +0000 2023,3,sopir angkot jakarta narik pakai selang oksigen bersyukur pondsxtzuyu tenangkankulitmu beritaindonesia beritadunia indonesiau,1651110113376354304,in,⬇️BACA RULES JANGAN NGELANGGAR,0,0,0,undipmenfess,Semarang-angkot.csv
40,Fri Apr 19 09:45:46 +0000 2024,0,jakarta angkot busuk kek gitu bayangin daerah kek,1781257876629340595,in,"Hornsey Rd, London N7 7AJ, UK",0,0,0,vibimuhlisin,Semarang-angkot.csv
41,Fri Sep 15 12:53:00 +0000 2023,1,info kecelakaan angkot mobil sienta jalan matraman raya jakarta timur tepatnya pasar palmeriam kondisi mobil sienta mengalami rusak berat situasi lintas mengalami kepadatan p ferry elshintaweekend,1702666826977882526,in,indonesia,0,3,0,Lenny_diary,Semarang-angkot.csv
42,Mon Aug 28 08:49:10 +0000 2023,0,tangsel kota autopilot dibanggakan dibangun swasta spt bsd city bintaro jaya alam sutera transportasi kota usia tk angkot tua bayarnya pakai cash udahlah tangerang raya gabung jakarta pindah provinsi,1696082484549800039,in,,0,1,0,RelawanHerviano,Semarang-angkot.csv
43,Wed May 08 09:24:36 +0000 2024,2,jakarta angkot jaklingko hebat gubernur penghargaan it p,1788137917254336535,in,Jakarta,5,3,0,didut,Semarang-angkot.csv
44,Mon Feb 20 23:15:46 +0000 2023,0,guys tarif angkot jakarta pemberhentian sampe pemberhentian tu beda beda tarif nomornya,1627809262763401216,in,Semarang - Jawa Tengah,0,0,0,kuasakatacom,Semarang-angkot.csv
45,Wed Apr 03 02:24:19 +0000 2024,0,rt banyaknya angkot ngetem ruas jalan margonda raya kepadatan lalin mengarah jakarta elshintanews,1775348575284986266,in,"Semarang, Jawa Tengah",0,0,0,Polsek_smgutara,Semarang-angkot.csv
46,Sat Nov 11 07:48:01 +0000 2023,0,cm adakah bantu isi kuisioner penelitian skripsiku kriterianya ragam transportasi jakarta tj angkot mrt lrt krl e money orang beruntung dm rep yaa barter jugaaa,1723246184381460664,in,"Semarang, Jawa Tengah",0,0,0,bukanputrimu,Semarang-angkot.csv
47,Sat Jul 01 05:18:22 +0000 2023,0,ajg gua ombang ambing angkot jakarta,1675010937580027905,in,Indonesia,0,1,0,ainiSNM,Semarang-angkot.csv
48,Tue Aug 01 05:15:00 +0000 2023,0,november liburan bandung berangkat whoosh min jakarta lokal baraya angkot rajamandala ka siliwangi ka pangrango krl b line jam kontras v,1686244113580986368,in,,0,0,0,RelawanHerviano,Semarang-angkot.csv
