,created_at,favorite_count,full_text,id_str,lang,location,quote_count,reply_count,retweet_count,username,keyword
0,Fri Apr 19 02:28:32 +0000 2024,28,pekan berkesempatan menjajal alibo angkot listrik bogor kesan pertamanya mikrotrans ac jakarta ujicoba unit nunggunya lumayan pembayaran brizzi katanyasih bertahap kue untung qris sih,1781147842729685387,in,Jakarta Capital Region,1,3,10,irhamsyarif,Jakarta-angkot.csv
1,Fri Feb 09 06:30:12 +0000 2024,45463,tinggal jakarta gapunya kendaraan ngerasa kesusahan karna angkot gratis tj deket bayar ngerantau kota bandung ngerasain banget perbedaan transportasi,1755841508975206524,in,Indonesia,2058,1358,3933,tanyakanrl,Jakarta-angkot.csv
2,Fri Jul 22 07:05:28 +0000 2022,19573,penasaran jakarta tuh abis duit bikin angkot jaklingko gratis bikin pengemudi angkot pekerja formal digaji kerasa bener servicenya bagus angkot pake acara drama ngetem maju mundur gang,1550376464859549697,in,"Pondok Aren, Indonesia",808,433,3999,adisetyop,Jakarta-angkot.csv
3,Fri May 24 14:06:20 +0000 2024,13,sopir lansia jakarta tidur angkot sewa kontrakan kehidupan sopir angkot lansia jakarta bernama amsori dijalani penuh kesulitan pendapatan mencukupi memaksa amsori tidur angkotnya,1794007024503783704,in,Indonesia,0,0,11,Melihat_Indo,Jakarta-angkot.csv
4,Sat Feb 17 04:46:33 +0000 2024,102,celaka akibat hindari angkot berhenti mata pengendara motor tertancap batang besi spion terjatuh motor akibat menghindari angkot berhenti dipinggir jalan jl raya pramuka kel utan kayu kec matraman jakarta timur jumat,1758714526701375916,in,,11,33,75,RadioElshinta,Jakarta-angkot.csv
5,Wed Apr 17 16:07:34 +0000 2024,5575,bayangin angkot jam malem stasiun depok kerja seharian jakarta tau besoknya berangkat menembus kemacetan jam pagi ikan sarden krl biar nyampe kantor gajinya kali,1780629185498886461,in,Buat Mulai Coding Career 👉🏻,65,111,1545,oianas_,Jakarta-angkot.csv
6,Thu Feb 29 11:33:47 +0000 2024,162,pemerintah penengah penyelesai demo menjurus anarkis sopir angkot merugikan masyarakat netijen solusi nya,1763165666105037239,in,Jakarta Capital Region,7,15,41,TfJakarta,Jakarta-angkot.csv
7,Tue Mar 26 12:48:27 +0000 2024,51,hai fairies tim apem update nih total paket takjil paket mini takjil dibagikan orang orang membutuhkan satpam driver ojol angkot tim apem jakarta international velodrome rawamangun,1772606539431284986,in,Indonesia,6,0,32,APEMinseok,Jakarta-angkot.csv
8,Fri Mar 22 09:18:59 +0000 2024,376,urgent angkot malang treatment jaklingko jakarta braw,1771104274820337786,in,rules/pp cek link‼️,52,76,17,ub_mfs,Jakarta-angkot.csv
9,Sun May 26 15:15:35 +0000 2024,0,angkot jakarta vs angkot solo menyala soloku,1794749229807911169,in,Surakarta Hadiningrat ,0,0,0,bella_nyo,Jakarta-angkot.csv
10,Fri May 03 08:54:54 +0000 2024,8,kejadian jalan margasatwa raya pasar minggu jakarta selatan angkot mencoba masuk jalur transjakarta diduga muncul bus transjakarta lajur kanan dihindari angkot terjepit pembatas jalan bus transjakarta,1786318506302275805,in,South Jakarta,0,0,2,IsuSoksial,Jakarta-angkot.csv
11,Thu Apr 25 11:10:05 +0000 2024,19,reformasi angkot membutuhkan komunikasi jakarta membutuhkan puluhan diskusi pelaku angkot terintegrasi sistem pelaku angkot jaminan operasional layak bersedia bergabung sistem,1783453420302827686,in,Indonesia ,2,1,6,stravenues,Jakarta-angkot.csv
12,Thu Mar 21 21:00:29 +0000 2024,7,gue pengguna transportasi publik non jakarta angkot bis miniarta elp terlintas bagus berpikir kendaraan bagus jalanan jelek grgr bupatinya korupsi mlu mahal bjir,1770918426191495283,in,바위게,0,3,4,septimberrr,Jakarta-angkot.csv
13,Fri Feb 23 06:08:03 +0000 2024,13,transjakarta rute pulo gadung walkot jakut via tipar cakung supir angkot lakukan protes puluhan sopir angkot jalan tipar cakung jakarta utara menggelar aksi protes jalan tipar cakung puskesmas sukapura jumat pagi memprotes,1760909367447343579,in,,1,4,7,RadioElshinta,Jakarta-angkot.csv
14,Mon May 06 02:47:24 +0000 2024,31,menerima informasi sopir angkot u menggelar aksi unjuk menolak transjakarta rute m pulo gadung kantor wali kota jakarta utara via tipar cakung beroperasi senin dihentikan,1787313184719999052,in,"Tambora, Indonesia",7,6,4,jalur5_,Jakarta-angkot.csv
15,Sat May 11 09:58:24 +0000 2024,24,kecelakaan lintas melibatkan mobil angkot a jurusan kampung melayu gandaria pengemudi ojek online angkot menabrak melindas pengemudi ojol penumpangnya berhenti lampu merah flyover pasar rebo jalan raya bogor ciracas jakarta timur,1789233587042320547,in,South Jakarta,0,9,3,IsuSoksial,Jakarta-angkot.csv
16,Sat Mar 02 08:22:41 +0000 2024,179,angkot eksisting bereskan pemerintah lokal bodetabek makan transportasi modern nyaman masyarakat kenyataan,1763842351347474499,in,Jakarta Capital Region,2,9,58,TfJakarta,Jakarta-angkot.csv
17,Mon May 06 23:47:09 +0000 2024,22,jakarta ngampus mirkolet angkot ps minggu lb bulus tarif kisaran k k mikroletnya udah jurusan tj u angkotnya udah jak lingkonya tarif k gratis bandung angkot deui bandung,1787630211670155540,in,"Jakarta Selatan, DKI Jakarta",0,1,0,LM_Alfatih,Jakarta-angkot.csv
18,Wed Apr 17 12:13:00 +0000 2024,7,satunya bikin gw bangga warga jakarta mikrotrans alias angkot gratis,1780570151462879558,in,Jakarta,0,1,2,joyhenri__,Jakarta-angkot.csv
19,Thu Mar 28 09:37:39 +0000 2024,43,adakah bantu isi kuisioner penelitian skripsiku kriterianya ragam transportasi jakarta tj angkot mrt lrt krl e money orang beruntung dm rep yaa dips,1773283298485092410,in,⬇️BACA RULES JANGAN NGELANGGAR,0,82,1,undipmenfess,Jakarta-angkot.csv
20,Sat Mar 02 08:20:35 +0000 2024,405,tije berusaha terbaik melayani masyarakat menghadirkan rute bermanfaat faktor tangsel bptj bs dishub tangsel angkot parung kaya tau,1763841823393694076,in,Jakarta Capital Region,18,28,115,TfJakarta,Jakarta-angkot.csv
21,Wed May 08 13:04:36 +0000 2024,6,cm need respondents bantu isi kuisioner penelitian skripsiku butuh responden huhu kriterianya ragam transportasi jakarta tj angkot mrt krl lrt linknya drop komentar dm jg total saldo k cont,1788193284931928336,in,,0,13,1,collegemenfess,Jakarta-angkot.csv
22,Fri Mar 08 14:46:47 +0000 2024,3,lulus orang jakarta angkot,1766113339326050614,in,,0,0,0,moondanqis,Jakarta-angkot.csv
23,Sat Feb 17 01:45:49 +0000 2024,30,perorangan pakai pertamax shell super subsidi bbm sih ngaruh tu kurir ekspedisi truck ayam truck sayur gojek angkot elf jakarta serang pakenya pertalite solar mampus lu rasain harga harga naek,1758669045237428437,in,Indonesia,1,2,6,Twt_dr_je,Jakarta-angkot.csv
24,Sun Mar 10 04:42:37 +0000 2024,0,angkot jakarta tuhhh luas gasii angkot bogor,1766686071109406926,in,,0,0,0,Susahipp,Jakarta-angkot.csv
25,Wed Feb 28 13:56:31 +0000 2024,10,halo jfriends mencoba angkot ac gratis jakarta salah rute dilayani angkot ac mikrotrans jak terminal rawamangun manggarai via pisangan pondok jati mikrotrans dimiliki pt lestari surya gema persada lsg,1762839196337942883,in,"Tambora, Indonesia",1,2,0,jalur5_,Jakarta-angkot.csv
26,Wed Feb 14 07:25:20 +0000 2024,0,rekapan nyoblos ni kertas alumni ugm kertas petahana kertas ketiga ex calon wagub kertas keempat supir angkot done from tps jagakarsa jakarta selatan jangangolput,1757667321592910325,in,,0,1,2,RizkyG_p,Jakarta-angkot.csv
27,Fri May 03 08:57:00 +0000 2024,14,sopir angkot kwk jurusan grogol cengkareng viral memakai selang oksigen menderita penyakit berbahaya sopir angkot bernama sa at berasal medan merantau jakarta ist,1786319032515195032,in,Indonesia,1,0,6,tribunnews,Jakarta-angkot.csv
28,Thu Mar 14 13:06:20 +0000 2024,2,tinggal jakarta tj angkot kwk merah jaklingko kena macet mengeluh wajar wajar orang ngeluh macet kendaaran pribadi salah penyumbang kemacetan kendaraan pake,1768262387558490149,in,"JAKARTA,INDONESIA",0,0,1,Muhammad_bayu10,Jakarta-angkot.csv
29,Wed Feb 28 10:55:30 +0000 2024,11,rute transjakarta pulo gadung walikota jakarta utara via tipar cakung m dihentikan protes sopir angkot sehubungan penolakan sopir angkutan reguler u pembukaan rute m rute m dihentikan kepala,1762793644590002503,in,"Tambora, Indonesia",1,1,4,jalur5_,Jakarta-angkot.csv
30,Sat Jun 01 15:50:24 +0000 2024,0,kek nya nunggu cewe makeup bandung jakarta via angkot,1796932315794571582,in,,0,1,0,fuckinex,Jakarta-angkot.csv
31,Wed May 08 06:45:06 +0000 2024,1,bantu isi kuisioner penelitianku butuh responden kriterianya ragam transportasi jakarta tj angkot mrt lrt krl saldo e wallet total k orang beruntung drop cont,1788097777307885688,in,,0,11,0,convomf,Jakarta-angkot.csv
32,Wed Apr 17 04:13:33 +0000 2024,0,harga angkot jakarta berapaan sih,1780449496616644897,in,Kwangya,0,2,0,babyyvenom,Jakarta-angkot.csv
33,Fri Mar 15 09:43:34 +0000 2024,8,transum jakarta tuh penumpang mrt menit disuruh transit angkot menit,1768573747794170143,in,,0,3,0,em_er_zet,Jakarta-angkot.csv
34,Fri May 24 11:23:15 +0000 2024,8,minggu gw intens bolak jakarta bekasi motor gw jaklinko pas udh sampe jalur bekasi udah jaklinko tuh pake angkot merah minggu naek angkot merah tarifnya beda cuk wkwk,1793965984581394671,in,pyongyang,0,3,2,barubikinlol,Jakarta-angkot.csv
35,Tue Apr 02 01:04:19 +0000 2024,5,faktanya kota kapasitas fiskalnya memadai bangun mrt jakarta itupun dibantu pusat aneh rakyat jelata kemakan janji bangun transum masal kota setara jakarta setara angkot jaklingko aj sih,1774966055255036159,in,tumaritis,2,1,0,_balade_sauvage,Jakarta-angkot.csv
36,Sun Jun 02 09:00:06 +0000 2024,1,guys orang bandung jakarta rencananya jakarta fair kereta gimana kayak turun stasiun angkot ojolnya gitu takut nyasar nanya nanya disana takut berniat,1797191450503131645,in,Indonesia,0,2,0,tanyakanrl,Jakarta-angkot.csv
37,Fri Feb 16 02:31:38 +0000 2024,10,hah lu ngetik anjir wkwkw org jakarta jkt gada mikrolet angkot digeser diajak kerjasama pemerintah drivernya digaji,1758318186448236677,in,Product Design'22,0,1,0,naracchin,Jakarta-angkot.csv
38,Fri May 03 04:41:31 +0000 2024,1,dw pookieeeeee i will fight thanos prabski gibron oligarki jakarta supir angkot resekkk pki temenmu maksa kos bareng for youuuuuuuu,1786254739627454813,in,chronically online,1,1,0,jahpouta,Jakarta-angkot.csv
39,Fri May 03 23:31:10 +0000 2024,2,sopir angkot jakarta narik pakai selang oksigen bersyukur pondsxtzuyu tenangkankulitmu beritaindonesia beritadunia indonesiau,1786539025266028974,in,"INDONESIA , JAKARTA ",0,0,0,2zodGabriel,Jakarta-angkot.csv
40,Fri May 10 17:36:31 +0000 2024,509,jakarta angkot busuk kek gitu bayangin daerah kek,1788986489336131639,in,,8,55,22,MuhammadSa16610,Jakarta-angkot.csv
41,Sat Mar 30 03:44:50 +0000 2024,29,info kecelakaan angkot mobil sienta jalan matraman raya jakarta timur tepatnya pasar palmeriam kondisi mobil sienta mengalami rusak berat situasi lintas mengalami kepadatan p ferry elshintaweekend,1773919285641138628,in,,2,5,16,RadioElshinta,Jakarta-angkot.csv
42,Tue Apr 02 06:15:50 +0000 2024,166,tangsel kota autopilot dibanggakan dibangun swasta spt bsd city bintaro jaya alam sutera transportasi kota usia tk angkot tua bayarnya pakai cash udahlah tangerang raya gabung jakarta pindah provinsi,1775044452786327917,in,,5,5,18,sendysantuy123,Jakarta-angkot.csv
43,Sun Mar 24 15:38:21 +0000 2024,110,jakarta angkot jaklingko hebat gubernur penghargaan it p,1771924520292802588,in,Zihuatanejo ,16,59,35,thedufresne,Jakarta-angkot.csv
44,Fri Apr 26 01:34:40 +0000 2024,0,guys tarif angkot jakarta pemberhentian sampe pemberhentian tu beda beda tarif nomornya,1783671000867160149,in,Indonesia,0,1,0,tanyakanrl,Jakarta-angkot.csv
45,Wed Apr 24 01:30:43 +0000 2024,11,rt banyaknya angkot ngetem ruas jalan margonda raya kepadatan lalin mengarah jakarta elshintanews,1782945230050001025,in,,1,3,2,RadioElshinta,Jakarta-angkot.csv
46,Tue Apr 30 11:13:57 +0000 2024,1,cm adakah bantu isi kuisioner penelitian skripsiku kriterianya ragam transportasi jakarta tj angkot mrt lrt krl e money orang beruntung dm rep yaa barter jugaaa,1785266334236098866,in,,0,25,1,collegemenfess,Jakarta-angkot.csv
47,Mon May 06 10:19:16 +0000 2024,0,ajg gua ombang ambing angkot jakarta,1787426900509589574,in,,0,0,0,taeoxo_jjh,Jakarta-angkot.csv
48,Wed Mar 20 11:18:26 +0000 2024,7,november liburan bandung berangkat whoosh min jakarta lokal baraya angkot rajamandala ka siliwangi ka pangrango krl b line jam kontras v,1770409562304377001,in,"Jakarta Selatan, DKI Jakarta",0,2,1,abu_mahdzuroh,Jakarta-angkot.csv
49,Mon Mar 25 05:18:20 +0000 2024,6,angkot gratis jakarta namanya mikrotrans jaklingko terminologi bener tije transjakarta busway,1772130878338093333,in,Jakarta,1,0,3,joyhenri__,Jakarta-angkot.csv
50,Sun Apr 21 23:35:08 +0000 2024,0,orang kabupaten jakarta maunya diajak angkot,1782191367491649972,in,Condet Mannat perapatan Seoul ,0,1,0,inirini_aja,Jakarta-angkot.csv
51,Mon May 20 11:42:14 +0000 2024,14,sopir angkot jakarta utara dishub dki menepati janjinya mengintegrasikan angkutan reguler jaklingko,1792521209894277448,in,Jakarta,2,4,4,kompascom,Jakarta-angkot.csv
52,Thu Apr 18 05:52:09 +0000 2024,37,jalur khusus bus salah tujuannya mengurangi lajur kendpri jakarta bangun busway penggusuran sengaja diperlebar iya min pembenahan transum udah tmb tmp amp angkot masuk brt lho,1780836698315993310,in,Bandung,3,0,6,tf_bandung,Jakarta-angkot.csv
53,Fri May 10 10:32:31 +0000 2024,3,dips need respondents bantu isi kuisionerku yuk butuh responden deadlinenya besok kriterianya transportasi jakarta mrt krl lrt angkot tj linknya twt saldo rpk orang beruntung,1788879788377334052,in,⬇️BACA RULES JANGAN NGELANGGAR,0,0,0,undipmenfess,Jakarta-angkot.csv
54,Thu Apr 25 11:59:14 +0000 2024,1,angkot depok mahal jakarta depok deket k jkt k gue tau pake gojek busway td kaget,1783465790840402165,in,writter accound. ,0,1,0,iskharaa,Jakarta-angkot.csv
55,Sat May 11 08:42:44 +0000 2024,3,angkutan kota angkot a jurusan jatinegara gandaria menabrak ojek daring online penumpangnya berhenti jalan raya bogor kecamatan ciracas jakarta timur jumat peristiwa kecelakaan jumat siang angkot a,1789214548047888522,in,,0,0,1,inilahdotcom,Jakarta-angkot.csv
56,Sat Mar 16 05:41:55 +0000 2024,2,dips plis bantu isi kuisioner skripsiku memenuhi kriteria ragam transportasi jakarta tj angkot mrt lrt krl saldo e wallet orang beruntung dm yaa plis mah memenuhi syarat,1768875320742945003,in,⬇️BACA RULES JANGAN NGELANGGAR,0,54,0,undipmenfess,Jakarta-angkot.csv
57,Thu May 09 17:27:35 +0000 2024,0,sd kurleb km dianter sepeda smp kurleb km kopaja sma kurleb km kuliah anjg gatau brp km jakarta tangerang serpong krl angkot,1788621855232033009,in,Bersamamu,0,0,0,hihanghoeng___,Jakarta-angkot.csv
58,Sun May 26 13:24:08 +0000 2024,4,sopir angkot tanjung priok jakarta utara gabung jaklingko kepastian,1794721181607837940,in,Jakarta,0,0,3,kompascom,Jakarta-angkot.csv
59,Sun Apr 21 05:29:47 +0000 2024,1,kartini ibuku rekan sepantarannya tetangga plesir jakarta beli eksrim ragusa charter angkot stasiun krl propublictransport,1781918233404281339,in,"Imodi-Ijasi, Nigeria",0,2,0,berketepatan,Jakarta-angkot.csv
60,Sat May 04 08:11:55 +0000 2024,2,kpd warga jakarta angkot jaklingko pake ktm unpad,1786670074813931907,in,Jatinangor,0,12,0,DraftAnakUnpad,Jakarta-angkot.csv
61,Sun Mar 17 06:30:02 +0000 2024,1,aloo adakah bantu isi kuisioner penelitian ta kriterianya ragam transportasi jakarta tj angkot mrt lrt krl e money orang beruntung dm yaa work,1769249819116315114,in,AUTOBASE — ❌POST MANUAL❌,0,8,0,worksfess,Jakarta-angkot.csv
62,Fri Mar 29 16:10:42 +0000 2024,0,keren yah jakarta angkot gratisnya,1773744604183236776,in,-,0,0,0,rithieriii,Jakarta-angkot.csv
63,Wed Apr 24 01:39:27 +0000 2024,0,lalinsonora banyaknya angkot ngetem ruas jalan margonda raya kepadatan lalin mengarah jakarta via,1782947429412991281,in,"Jakarta Barat, DKI Jakarta",0,0,0,SonoraFM92,Jakarta-angkot.csv
64,Sat Mar 09 03:58:28 +0000 2024,1,angkot memenuhi standar angkot jakarta,1766312571605586212,in,he/him,0,0,0,CIPlNANG,Jakarta-angkot.csv
65,Thu May 30 02:01:36 +0000 2024,12,anies bikin jaklingko angkot gratis jakarta sampe jalan beliau udh banget projek pendidikan sampe berjalan pikir situ hebat nepatin janji nya,1795998969132171475,in,,0,0,2,mxxnblxxsms,Jakarta-angkot.csv
66,Sat Mar 30 08:59:05 +0000 2024,1,angkot terbakar jakarta selatan kerugian capai rp juta news,1773998372221075586,in,Jakarta,0,0,0,liputan6dotcom,Jakarta-angkot.csv
67,Thu Apr 25 05:36:21 +0000 2024,0,peringati angkutan nasional intip karoseri suzuki carry warnai angkot jakarta,1783369434671067300,in,Cipinang Jaya 2 ,0,0,0,ruangotodotcom,Jakarta-angkot.csv
68,Fri May 10 11:13:30 +0000 2024,0,need respondents bantu isi kuisionerku yuk butuh responden deadlinenya besok kriterianya transportasi jakarta mrt krl lrt angkot tj saldo rpk orang beruntung linknya twt,1788890100132356375,in,,0,1,0,convomf,Jakarta-angkot.csv
69,Tue Apr 16 08:00:58 +0000 2024,7,an btl jakarta kerja kenek supir angkot tembak kena jaring pemprov dki pas disisir bang ali kaget bang ali lulus sma jaman lulus sma pencapaian oke dimasukin dishub,1780144336958869802,in,,0,1,2,ardi_tama1,Jakarta-angkot.csv
70,Thu May 16 13:34:43 +0000 2024,2,angkot memotret warung madura jakarta kesabaran kehematan bertahan membiayai anak anaknya mondok sekolah menerima masukan konsumen melayani teleponan,1791099966338850970,in,Paiton Probolinggo Jawa Timur,0,0,0,AhmadSahidah,Jakarta-angkot.csv
71,Tue Apr 23 03:39:41 +0000 2024,0,angkot jakarta tuh ongkosnya sih dikasih goceng marah kagak bogor segituan,1782615301663989825,in,Indonesia ,0,2,0,aylmhrn,Jakarta-angkot.csv
72,Sat Mar 23 21:53:15 +0000 2024,3,serius gue turun petukangan kayak sedih arah bayoran ama arah tangerang angkotnya beuuuhh perbedaan jakarta vs tangerang keliatan angkotnya warga jakarta ngantri udah spot nya angkot nya ngetem langsung jalan,1771656481407934621,in,,0,1,0,terwiwiwiwi,Jakarta-angkot.csv
73,Fri May 24 17:30:15 +0000 2024,0,angkot angkot jakarta bekasi kota normal peminatnya,1794058344316956930,in,17412,0,0,0,Abubakr_Saliim,Jakarta-angkot.csv
74,Sat Apr 27 07:42:33 +0000 2024,0,gua tauuu tiket flight domestik harganya ngotak kocak ngetweet ngecompare tiket padang jakarta jt padang rban kayak lu naek angkot jakarta bogor jakarta jogja beda gasih ongkosnya appleapple,1784125970120859837,in,,0,0,0,awalakuberjumpa,Jakarta-angkot.csv
75,Sun Jun 02 15:06:18 +0000 2024,0,pemerintah pemerintah berulang ulang gua bilang jakarta percontohan angkot terintegrasi tuh susah sistem transmum,1797283608442679413,in,🏳️‍🌈,0,0,0,sertrawline,Jakarta-angkot.csv
76,Sun Mar 17 14:51:19 +0000 2024,2,aloo adakah bantu isi kuisioner penelitian ta butuh responden kriterianya ragam transportasi jakarta tj angkot mrt lrt krl e money orang beruntung cont,1769375968907727111,in,,0,15,0,collegemenfess,Jakarta-angkot.csv
77,Wed Feb 21 05:33:06 +0000 2024,0,setuju supir taksi jepang supir angkot jakarta wkwkwk ril cuy no fek gue mendingan supir angkot jkt nurunin penumpang mepet pinggir jalan supir taksi mah ditengah minggir wkwkwk,1760175794138312774,in,Indonesia,0,0,0,farahmhr,Jakarta-angkot.csv
78,Fri Apr 05 17:50:54 +0000 2024,0,emang anjing angkot jakarta kecopetan deket alfamart pasar senen dihadang orang sopir nungguin pake angkot ketiplek angkot video kerasa dicopet ilang hape ngejer barang bawaan bener orang ngelietin doang,1776306534534070491,in,"Bali, Indonesia",0,0,0,Septiawan7,Jakarta-angkot.csv
79,Sun May 26 11:29:55 +0000 2024,1,first jobber kota sih kerja jakarta tuh emang bener kos mrt lrt busway angkot ojol sampe ribu udah nyampe kantor gpp duit pas pasan cape fisik amp cape pikiran plus abis perjalanan,1794692439133110521,in,"Jakarta Capital Region, Indone",0,1,0,jayakabajay,Jakarta-angkot.csv
80,Sat Apr 13 01:41:31 +0000 2024,0,wkwkwk inget jakarta liat toko amp angkot sigernya berasa pulkam,1778961683941408924,in,Ravenclaw,0,0,0,kyunoona99,Jakarta-angkot.csv
81,Sat Mar 30 03:23:41 +0000 2024,2,angkot gw tinggal peremajaan armada supir suka nyetir trayek gemuk sisa orang tua muda muda udh ojol jakarta supir angkot udh gabung jaklingko pindah ojol wkwk,1773913965711819001,in,,0,2,0,ardi_tama1,Jakarta-angkot.csv
82,Sun Mar 17 05:56:22 +0000 2024,2,aloo bantu isi kuisioner penelitian ta kriterianya ragam transportasi jakarta tj angkot mrt lrt krl e money orang beruntung dm yaa barteran yupi,1769241345741422946,in,Indonesia,0,6,0,YUPIEN_FESS,Jakarta-angkot.csv
84,Thu Mar 14 08:15:00 +0000 2024,3,angkot jaklingko rp diminati warga jakarta,1768189070222708990,in,AUTOBASE — ❌POST MANUAL❌,0,21,0,worksfess,Jakarta-angkot.csv
85,Sat Feb 24 11:51:12 +0000 2024,3,nya takbiran rame rame nyewa angkot muter keliling jakarta atap angkotnya anjir seru banget,1761358109346550205,in,Indonesia,0,0,1,kompasiana,Jakarta-angkot.csv
86,Tue Apr 09 16:16:21 +0000 2024,0,tk diantar sd pas lhokseumawe jalan kaki pas medan full pas jakarta jemputan angkot smp jemputan sma angkot kuliah bawa mobil angkot,1777732292439667035,in,,0,0,0,wimpitito,Jakarta-angkot.csv
87,Wed May 08 11:03:48 +0000 2024,0,lalinsonora lintas ruas jl raya sawangan arah depok terpantau macet imbas kendaraan angkot mengalami gangguan mesin didekat pertigaan rs bhakti yudha via bp aang,1788162883064602949,in,"Jakarta Selatan, DKI Jakarta",0,0,0,zenethobarony,Jakarta-angkot.csv
88,Fri May 31 00:39:19 +0000 2024,1,udah gue duga nggak truk zaman angkot jakarta skrg perhatikan angkot biru a banget ketemu supir underage ugalan,1796340649421320635,in,"Jakarta Barat, DKI Jakarta",0,0,1,SonoraFM92,Jakarta-angkot.csv
89,Wed Mar 27 08:41:43 +0000 2024,1,mimin pingin tau nih kenangan angkot wilujeng enjing cemunguutt cim infocimahi cimahi kotacimahi bandung jawabarat jakarta pagi semangat angkot,1772906835584139721,in,"Melbourne, Victoria",0,0,0,catsbutanything,Jakarta-angkot.csv
90,Fri May 10 00:19:17 +0000 2024,0,suzuki carry disulap warnai angkot jakarta gooto,1788725460895199262,in,,0,0,0,infocimahico,Jakarta-angkot.csv
91,Fri Apr 26 05:09:34 +0000 2024,5,sopir angkot jakarta utara mengaku menombok uang setoran sewa angkot akibat sepinya penumpang,1783725083615449332,in,Indonesia,0,0,0,tempodotco,Jakarta-angkot.csv
92,Tue May 21 02:07:08 +0000 2024,1,jakarta sistem kuota total angkot konvesional dpt kuota mikrotrans,1792738869772959834,in,Jakarta,0,1,1,kompascom,Jakarta-angkot.csv
93,Thu Feb 29 11:47:52 +0000 2024,2,duuhh sayang angkutan kota angkot jakarta blm diseragamin jaklingko enak gapake ngetem trs supirnya nyetirnya jg ugalan ngerokok sepengalaman gue sih,1763169211755716916,in,Jakarta Capital Region,0,1,0,TfJakarta,Jakarta-angkot.csv
94,Fri May 31 16:34:08 +0000 2024,0,lalinsonora lintas macet ace hardware intercon arah pom meruya kembangan akibat angkot biru ngetem,1796580933396824576,in,,0,1,0,zagiputr,Jakarta-angkot.csv
95,Thu Mar 14 09:01:35 +0000 2024,0,jakarta angkot to apakanat jaklingo,1768200792098652544,in,"Jakarta Barat, DKI Jakarta",0,0,0,SonoraFM92,Jakarta-angkot.csv
96,Fri May 10 23:16:28 +0000 2024,24,pesawat pas jakarta pesawat pas bokap meninggal tj pas abis ngegep mantan selingkuh jaraknya halte karet benhil angkot sekolah dapet ranking,1789072042362556758,in,neng pelukanmu,0,17,0,raslokal,Jakarta-angkot.csv
97,Fri Mar 08 14:16:48 +0000 2024,1,cm need respondents bantu isi kuisionerku yuk butuh responden deadlinenya besok kriterianya transportasi jakarta mrt krl lrt angkot tj saldo rpk orang beruntung linknya twt,1766105795094343755,in,above ur tweets,0,3,0,GodikaGo,Jakarta-angkot.csv
98,Fri May 10 12:44:45 +0000 2024,0,layanan transjakarta m rute pulo gadung wali kota jakarta utara beroperasi dinas perhubungan dki jakarta syafrin liputo mengakui rute penolakan sopir angkot transjakarta angkot medcomid,1788913066002018608,in,,0,0,0,collegemenfess,Jakarta-angkot.csv
99,Thu May 09 08:10:00 +0000 2024,0,bicara transportasi serasa pindah planet jakarta udah krl mrt lrt tj jaklingko angkot bandung jam malam udah pd pulang ojol fluktuatif kdg murah kdg mahal beli mio mirza bekas harga jtan servis cvt dlu biar kuat nanjak,1788481531767562427,in,"Jakarta Capital Region, Indone",0,0,0,medcom_id,Jakarta-angkot.csv
100,Tue Apr 02 03:03:19 +0000 2024,1,bukti nyata warga jakarta menikmatin angkot gratis,1774996001218326960,in,Kota Makassar,0,1,0,syanuwarfitrah,Jakarta-angkot.csv
101,Sun Jun 02 04:41:12 +0000 2024,0,angkot mikrotrans jaklingko suka salah capres dulunya menggagas perbaikan angkot jakarta aneh it doesn t make sense at all,1797126294309839028,in,,0,0,0,jarnas_dki,Jakarta-angkot.csv
102,Sun Mar 31 14:44:00 +0000 2024,3,angkot terminal tanjung priok jakarta utara mengalami peremajaan pembaruan bergabung jaklingko,1774447558112489574,in,Depok,0,0,1,AlvianWidyatama,Jakarta-angkot.csv
103,Tue May 21 00:47:09 +0000 2024,1,dinas perhubungan dishub dki jakarta komunikasi sopir angkot terkait layanan bus transjakarta m rute pulo gadung wali kota jakarta utara,1792718742570643808,in,Jakarta,0,0,0,kompascom,Jakarta-angkot.csv
104,Thu May 09 09:27:37 +0000 2024,0,keterbatasan biaya amsori memilih mengontrak rumah tidur angkot sewaannya,1788501063877943359,in,Jakarta - Indonesia,0,1,0,mediaindonesia,Jakarta-angkot.csv
105,Fri May 24 00:04:12 +0000 2024,0,aggaran tersedianya penyebab angkot reguler jakarta utara jakut bergabung jaklingko,1793795097253102004,in,Jakarta,0,0,0,kompascom,Jakarta-angkot.csv
106,Sun May 26 04:12:34 +0000 2024,1,mobil cobain mobil travel cikarang jakarta angkot depok beserta macetnya angkot alphard beda banget krl mrt wlw kereta beda banget cok,1794582375571333300,in,Jakarta,1,0,0,kompascom,Jakarta-angkot.csv
107,Tue Apr 02 05:46:38 +0000 2024,67,pengemudi angkot gelar aksi mogok beroperasi jalan tipar cakung jakarta utara bentuk aksi penolakan pengoperasian bus transjakarta,1775037102092415182,in,jakarta,2,2,3,camarilo,Jakarta-angkot.csv
108,Mon May 06 08:51:56 +0000 2024,0,karoseri suzuki carry warnai angkot jakarta,1787404921987621057,in,NKRI,0,0,0,antaranews,Jakarta-angkot.csv
109,Thu May 02 13:19:46 +0000 2024,0,besok tarif tol jakarta cikampek rp respons sopir angkot beritasatu news berita,1786022772915003458,in,Jakarta Capital Region,0,0,0,papuatimes1,Jakarta-angkot.csv
